article_id,title,content
1,The Rise of Quantum Computing,"Quantum computing is making waves in the tech industry as scientists continue to explore its potential. Unlike classical computers, quantum computers process data through qubits, which can represent multiple states simultaneously. This breakthrough opens up new possibilities in fields like cryptography, material science, and artificial intelligence. As the technology matures, quantum computing could solve complex problems that are beyond the capabilities of traditional systems, such as simulating molecular interactions at the quantum level."
2,The Future of Electric Cars,"Electric vehicles (EVs) are rapidly gaining traction as the future of transportation. Automakers are increasingly focusing on EV development due to rising concerns over climate change and the depletion of fossil fuels. With advancements in battery technology, electric cars are becoming more affordable, with longer driving ranges. Governments are also providing incentives to encourage EV adoption, aiming to reduce carbon emissions and promote sustainability in the automotive industry."
3,Exploring Mars: The Next Frontier,"NASA's upcoming mission to Mars aims to explore the planet's surface in greater detail. The Perseverance rover, equipped with advanced tools, will search for signs of ancient life and collect samples to be returned to Earth. Scientists are also studying the planet's potential for future human colonization, with the possibility of utilizing local resources like water ice to support long-term missions."
4,The Impact of AI on Healthcare,"Artificial intelligence is transforming the healthcare sector, with applications ranging from diagnostics to personalized medicine. Machine learning algorithms can analyze vast amounts of medical data, detecting patterns that humans may miss. AI-powered tools are also being used to develop more accurate predictive models, improving patient outcomes and reducing healthcare costs. As AI continues to evolve, its role in medicine will only expand."
5,Climate Change and the Future of Agriculture,"As global temperatures rise, the agricultural industry faces numerous challenges. Changes in weather patterns, such as more frequent droughts and unpredictable rainfall, are affecting crop yields worldwide. Researchers are developing new techniques to help farmers adapt, including drought-resistant crops and innovative farming practices. The goal is to ensure food security while minimizing the environmental impact of agriculture."
6,Advancements in Space Tourism,"Space tourism has become an exciting prospect for the future, with private companies like SpaceX, Blue Origin, and Virgin Galactic leading the charge. These companies are working on developing spacecraft that can carry civilians into low Earth orbit, allowing people to experience space travel firsthand. As the technology progresses, space tourism could eventually become more accessible to a broader range of people, offering a unique and thrilling adventure."
7,The Rise of Cryptocurrency,"Cryptocurrency, a digital form of currency that uses cryptography for security, has gained popularity over the past decade. Bitcoin, the first and most well-known cryptocurrency, has sparked interest from investors and governments alike. Cryptocurrencies offer advantages like decentralization, lower transaction fees, and the potential for high returns, but they also face challenges such as volatility and regulatory uncertainty."
8,The Evolution of Remote Work,"Remote work has become increasingly common, particularly following the COVID-19 pandemic. Companies have adapted by offering flexible work arrangements, allowing employees to work from home or other locations. This shift has led to increased productivity for many workers, but it also presents challenges related to work-life balance, communication, and team collaboration. As remote work continues to evolve, companies are investing in technology to facilitate seamless operations."
9,Genetic Engineering and the Ethics of CRISPR,"CRISPR-Cas9 is a revolutionary gene-editing technology that allows scientists to modify DNA with unprecedented precision. This tool has the potential to treat genetic disorders, enhance crops, and even eliminate certain diseases. However, its use has raised ethical concerns, especially regarding the potential for 'designer babies' and unintended consequences. As CRISPR technology advances, ethical frameworks will need to be developed to guide its responsible use."
10,The Global Water Crisis,"Freshwater resources are becoming increasingly scarce in many parts of the world. Climate change, pollution, and population growth are contributing to the global water crisis. Organizations are working to develop sustainable water management practices and innovative solutions, such as desalination and water recycling, to address these challenges. Ensuring access to clean water is critical for public health, agriculture, and overall well-being."
11,Virtual Reality in Education,"Virtual reality (VR) technology is transforming the educational landscape by offering immersive learning experiences. Students can engage with content in ways that traditional teaching methods cannot provide, such as virtual field trips or hands-on practice in a safe environment. VR has been particularly useful in fields like medicine, engineering, and history, allowing learners to gain practical skills and experiences that enhance their understanding."
12,The Evolution of Social Media,"Social media platforms like Facebook, Twitter, and Instagram have significantly influenced how people communicate and interact with each other. These platforms have revolutionized marketing, politics, and even personal relationships. However, concerns over privacy, misinformation, and addiction are prompting calls for greater regulation and accountability. As the social media landscape evolves, new platforms are emerging, while existing ones are being forced to adapt to changing user expectations."
13,The Importance of Mental Health Awareness,"Mental health awareness is gaining momentum as societies recognize the impact of mental well-being on overall health. Conditions like depression, anxiety, and PTSD affect millions of people worldwide, but stigma and a lack of understanding often prevent individuals from seeking help. Initiatives to raise awareness, reduce stigma, and provide accessible mental health resources are essential in fostering healthier communities."
14,The Future of Artificial Intelligence,"Artificial intelligence is evolving at a rapid pace, with applications spanning across industries like healthcare, finance, and transportation. AI systems are becoming more advanced, with deep learning algorithms capable of processing complex data and making decisions with little human intervention. As AI continues to develop, it raises questions about the future of work, ethics, and its potential to outperform human intelligence."
15,Ocean Conservation and the Fight Against Pollution,"The oceans cover more than 70% of the Earth's surface, but they are increasingly threatened by pollution, overfishing, and climate change. Organizations and governments are working to protect marine ecosystems through policies aimed at reducing plastic waste, promoting sustainable fishing practices, and preserving coral reefs. The health of the oceans is critical not only for biodiversity but also for the livelihoods of millions of people who depend on them."
16,The Rise of Streaming Services,"Streaming services like Netflix, Hulu, and Amazon Prime have revolutionized the entertainment industry. Consumers now have access to a vast library of movies, TV shows, and documentaries on-demand. As streaming platforms continue to dominate, traditional cable TV networks are struggling to keep up. The competition has led to the production of original content, as platforms aim to differentiate themselves and attract subscribers."
17,The Role of Artificial Intelligence in Finance,"AI is transforming the financial services industry, providing tools for automated trading, fraud detection, and personalized financial advice. Machine learning algorithms can process large volumes of data quickly, identifying patterns and trends that would be difficult for humans to detect. As AI technology continues to improve, its role in finance will expand, helping businesses and individuals make smarter investment decisions and mitigate financial risks."
18,The Future of Biotechnology,"Biotechnology is at the forefront of many scientific advancements, from genetic research to the development of new medicines. Breakthroughs in gene therapy, stem cell research, and biologics are revolutionizing the treatment of diseases. The potential for personalized medicine, where treatments are tailored to an individual’s genetic makeup, could significantly improve patient outcomes. However, the rapid pace of innovation in biotechnology also raises ethical and regulatory challenges."
19,The Power of Renewable Energy,"Renewable energy sources like solar, wind, and hydroelectric power are playing an increasingly important role in reducing dependence on fossil fuels. As technology advances, the cost of renewable energy has decreased, making it more accessible to consumers and businesses alike. Governments around the world are setting ambitious targets for renewable energy adoption, aiming to reduce carbon emissions and combat climate change."
20,The Impact of Automation on Jobs,"Automation is transforming industries across the globe, from manufacturing to customer service. Robots, AI, and other technologies are taking over tasks that were once performed by humans, leading to greater efficiency and reduced costs. However, this shift also raises concerns about job displacement, especially for workers in industries most affected by automation. Solutions such as retraining programs and job creation in emerging sectors are critical to mitigating these effects."
21,Blockchain Technology and Its Applications,"Blockchain technology, the foundation of cryptocurrencies like Bitcoin, has applications far beyond digital currency. It provides a secure, decentralized way to record transactions, making it useful in fields like supply chain management, voting systems, and healthcare. The transparency and immutability of blockchain can enhance security, reduce fraud, and streamline processes across industries."
22,The Rise of 3D Printing,"3D printing technology has advanced significantly in recent years, enabling the creation of complex objects from digital models. It has applications in various industries, including healthcare, aerospace, and manufacturing. For example, 3D printing is being used to produce prosthetics and medical implants, as well as parts for airplanes and cars. As the technology evolves, it could lead to more efficient and cost-effective production methods."
23,The Exploration of the Deep Sea,The deep sea remains one of the least explored and most mysterious parts of the planet. Advances in submersible technology and underwater robots have allowed scientists to explore the ocean depths and discover new species. These expeditions not only increase our understanding of marine life but also provide valuable insights into the Earth’s geological processes. Exploring the deep sea could also uncover new resources for human use.
24,The Growth of E-commerce,"E-commerce has experienced tremendous growth in recent years, particularly during the COVID-19 pandemic. Consumers are increasingly shopping online for convenience and safety. This shift has led to the expansion of online marketplaces and direct-to-consumer brands. As e-commerce continues to grow, businesses are adopting new technologies, such as artificial intelligence and augmented reality, to enhance the online shopping experience."
25,The Role of Big Data in Business,"Big data refers to the vast amounts of data generated every day by businesses, consumers, and devices. By analyzing this data, companies can gain insights into consumer behavior, optimize operations, and make more informed decisions. Industries like retail, healthcare, and finance are leveraging big data to improve their services and products, while also addressing privacy concerns associated with data collection and use."
26,The Growth of Wearable Technology,"Wearable technology, such as smartwatches and fitness trackers, has become increasingly popular in recent years. These devices allow individuals to track their health and fitness, monitor their sleep patterns, and stay connected to their digital lives. As wearable technology continues to evolve, new features and functionalities are being added, making them more useful for a wide range of applications, from healthcare to entertainment."
27,The Future of Urban Mobility,"Urban mobility is undergoing a transformation, with new technologies like electric scooters, self-driving cars, and bike-sharing systems reshaping transportation in cities. These innovations offer alternatives to traditional public transportation and private car ownership, reducing traffic congestion and pollution. As cities grow, sustainable mobility solutions will be critical in ensuring efficient and equitable transportation systems for all residents."
28,The Importance of Cybersecurity,"As our reliance on digital technology grows, so does the threat of cyberattacks. Cybersecurity is essential in protecting sensitive information from hackers and ensuring the integrity of online systems. Businesses, governments, and individuals all have a role to play in safeguarding digital assets. With the rise of artificial intelligence and the Internet of Things, the need for robust cybersecurity measures is more critical than ever."
29,The Challenges of Urbanization,"Urbanization is one of the defining trends of the 21st century, with more people moving to cities in search of better opportunities. While urban areas offer economic benefits and improved infrastructure, they also face challenges like overcrowding, pollution, and inequality. Addressing these issues requires innovative solutions, such as sustainable urban planning, affordable housing, and improved public services."
30,The Promise of Clean Energy Technologies,"Clean energy technologies are paving the way toward a sustainable future. Solar, wind, and hydrogen power are among the most promising alternatives to fossil fuels. As these technologies become more efficient and affordable, they have the potential to revolutionize energy production and reduce greenhouse gas emissions. Governments and businesses are investing heavily in clean energy to combat climate change and create a greener future."
